Région,Département,Commune,Nom du festival,Début,Fin,Genre,Site web,Téléphone,,Texte,"Lon,Lat",Nom,Fonction,Citation
Auvergne-Rhône-Alpes,Rhône,Lyon,Magique ,15/04/2022,05/03/2023,Autres,m.museedesconfluences.fr/,04 28 38 12 12,,"La magie du monde est exposée dans l'établissement avec son lot de sorcières, chamans ou encore guérisseurs. Le pouvoir de guérir mais aussi d'envoûter se dévoile à travers un parcours imaginé comme une balade dans une forêt mystérieuse. ","4.7718489,45.707486",,,
Auvergne-Rhône-Alpes,Haute-Savoie,Le Grand-Bornand ,Au bonheur des mômes ,21/08/2022,26/08/2022,Autres,aubonheurdesmomes.com,,"Contact presse
Julien-Gabriel PERBELLINITél. 00 33 (0)4 50 02 78 05 / 00 33 (0)6 28 42 66 23
E-mail : jgperbellini@legrandbornand.comLe Grand-Bornand Tourisme
Tel : 04 50 02 78 05 /  00 33 (0)6 28 42 66 23","Le rendez-vous du spectacle vivant jeune public organise sa programmation autour de son anniversaire puisqu'il fête cette année ses 30 ans. Pas moins de 87 compagnies dont 17 internationales et 111 spectacles sont prévus. Geometria, de la compagnie Roseland Musical, est un spectacle de danse contemporaine pas comme les autres puisqu'il faut des lunettes 3D pour en profiter. Quant à Aldebert, il présente son Enfantillages 4.","6.403552,45.9202439",,,
Auvergne-Rhône-Alpes,Haute-Savoie,Chamonix ,Cosmo Jazz,23/07/2022,30/07/2022,Musique,https://cosmojazzfestival.com/,,,"Le jazz s'installe en montagne. Des concerts gratuits sont prévus en altitude en matinée, puis une programmation payante prend le relai l'après-midi au parc Montet. Avec Ana Carla Maza, Kyllelee Evans, Derya Yldirim, Black Sea Dahu, Thibault Cauvin, Louis Winsberg ""Jaleo"", Roberto Fonseca trio, Chirstian Sands, Cuarem Quarteto, André Manoukian Quartet, Sylvain Rifflet, Anne Paceo et Avishai Cohen.","6.789014,45.9295043",,,
Auvergne-Rhône-Alpes,Isère,Grenoble,Festival du film court en plein air ,28/06/2022,02/07/2022,Cinéma,cinemathequedegrenoble.fr,04 76 54 43 51,,"Les films en compétition, de tous genres et tous formats, sont projetés sur la place Saint-André chaque soir. Dans la journée, des rencontres-apéros sont organisées afin d'échanger avec les réalisateurs et réalisatrices. A noter, un stage d'analyse est proposé durant deux après-midis sur le thème des pionnières du cinéma et une séance spéciale dans la nuit du vendredi au samedi est consacrée aux films de femmes. IL FAUT TEL. TEL PAS DE REPONSE","5.6780039,45.154005",,,
Auvergne-Rhône-Alpes,Ardèche,Lussas,Etats généraux du film documentaire ,21/08/2022,27/08/2022,Cinéma,lussasdoc.org,,,"La sélection ""Route du doc"" est consacrée au Japon contemporain, en collaboration avec le festival de Yamagata. La catégorie ""Histoire de doc"" prévoit la projection d'oeuvres invitant à parcourir l’histoire du documentaire à Cuba, principalement des années 60 avec une programmation qui s’étend de 1955 à 1974. Les projections concernent les films les plus connus comme ceux de Santiago Alvarez au plus confidentiels de Nicolás Guillon Landrián et Sara Gomez. Cette catégorie est en partenariat avec l'Institut cubain des arts et de l'industrie cinématographiques et l'INA. ""Fragment d’une œuvre"" est dédié à celle du réalisateur italien Mauro Santini.","4.427377,44.593637",,,
Auvergne-Rhône-Alpes,Rhône,Lyon,Les nuits de Fourvière ,02/06/2022,30/07/2022,Théâtre / Arts de la rue / Cirque,nuitsdefourviere.com,,,"Théâtre, cirque, musique et danse ponctuent le festival. Le groupe acrobatique de Tanger présente FIQ ! (Réveille-toi), une création qui mêle acrobates, voltigeurs, footfreestylers et breakdancers. Les costumes et le décor sont pensés par le photographe marocain Hassan Hajjaj. Le chorégraphe Benjamin Millepied s'approprie le ballet de Prokofiev Roméo et Juliette avec ses danseurs et danseuses du L.A. Dance Project.","4.7718489,45.707486",,,
Auvergne-Rhône-Alpes,Savoie, Aix-les-Bains et Abbaye d’Hautecombe,Rencontres littéraires en pays de Savoie,10/06/2022,12/06/2022,Littérature,fondation-facim.fr,04 79 60 59 00,04 79 96 73 29,"Cinq auteurs et autrices rythment les animations du festival. Philippe Claudel présente son ouvrage De quelques frontières. Nicolas de Crécy, Marie Richeux, Clara Ysé, et  Lou Kanche en résidence sont aussi de la partie pour une édition autour des notions de frontière, de la transmission, de l'héritage. La table ronde interroge sur le passage tel qu'il existe dans leurs oeuvres : d’un territoire à l’autre, d’une génération à la suivante, du texte à l’image etc. Les différents talents des invités permettent aussi un concert de Clara Ysé en ouverture et la projection de Tous les Soleils de Philippe Claudel en clôture. A noter la présence d'une librairie éphémère le temps des festivités. ","6.81372,45.8331266",,,
Auvergne-Rhône-Alpes,Drôme,Grignan ,Festival de la correspondance ,05/07/2022,09/07/2022,Littérature,grignan-festivalcorrespondance.com,04 75 53 63 21,Tél. : 04 75 46 55 83,"La manifestation se consacre aux années 1950 en France et aux figures marquantes de cette époque. Des lectures de correspondances sont proposées chaque jour. Il s'agit parfois de mots d'amitiés, par exemple entre Jean Cocteau et Jean Marais ou entre Albert Camus et Nicola Chiaromonte, militant antifasciste et anti-communiste. Les lettres d'amour viennent également émailler la programmation avec les textes de Simone de Beauvoir envoyés à Jean-Paul Sartre ou d'Edith Piaf à Louis Gérardin. MAIL ENVOYE. MESSAGE LAISSE","4.854393,44.395624",,,
Auvergne-Rhône-Alpes,Haute-Loire,"Chambon-sur-lignon, Devesset et Saint-Agrève",Lectures sous l'arbre ,14/08/2022,20/08/2022,Littérature,lectures-sous-larbre.com/,04 75 30 65 06,,"Pendant une semaine, la poésie et la littérature sont à l'honneur avec des lectures et des rencontres d'auteurs programmées. Cette année la Corée est au premier plan avec également des cycles de cinéma coréen. Les éditions Zulma sont l'éditeur invité. MAIL ENVOYE","4.3675494197085,45.0478123197085",,,
Auvergne-Rhône-Alpes,Puy-de-Dôme,Clermont-Ferrand,Europavox,30/06/2022,03/07/2022,Musique,europavoxfestivals.com,,,"La musique européenne contemporaine s'installe sur la place du 1er mai pour trois jours de festivités. Font partie de la programmation cette année : Claire Laffut, Lujipeka, Yseult, Clara Luciani, Angèle, Emilie Zoé, Vladimir Cauchemar, Romane Santarelli, Kane, Xinobi et Malaka. ","3.053296,45.755755",,,
Auvergne-Rhône-Alpes,Isère,Vienne ,Jazz à Vienne,29/06/2022,13/07/2022,Musique,jazzavienne.com,04 74 78 87 87,,"Trois scènes principales parmi les 37 lieux de festivités sont mises en place pour accueillir les artistes. Celle du théâtre antique reçoit Herbie hancock, Thomas de Pourquery, Yann Tiersen et MC Solaar et Angélique Kidjo. Cette dernière invite pour une carte blanche la chanteuse nigériane Yemi Alade et le guitariste de jazz cubain Joel Hierrezuelo. ","4.837252,45.4867009",,,
Auvergne-Rhône-Alpes,Haute-Savoie,Evian-les-Bains,Rencontres musicales d'Evian ,25/06/2022,02/07/2022,Musique,lagrangeaulac.com,04 50 26 85 00,,"Dans la salle en bois de la Grange au Lac, l'orchestre de Genève et celui des pays de Savoie ouvrent le bal. Au menu, Le Printemps de Debussy, L'Oiseau de feu de Stravinsky, Le Corsaire de Berlioz et le Concerto pour piano n°2 de Berlioz. A noter le récital du jeune pianiste Alexandre Kantorow, gagnant du concours Tchaïkovski en 2019.","6.568017,46.3787809",,,
Auvergne-Rhône-Alpes,Isère,Autrans,Vercors Music Festival,01/07/2022,03/07/2022,Musique,vercorsmusicfestival.com,,,"Programmation variée sur les trois scènes du massif du Vercors avec à l'affiche Ben Mazué, Biglo et Oli, Cléa Vincent, Laura Cahen, Lombre etc. ","5.507998,45.15516",,,
Auvergne-Rhône-Alpes,Savoie,Aix-les-bains,Musilac,06/07/2022,10/07/2022,Musique,www.musilac.com,04 79 88 68 05,"Presse : bipcom

isaberanger@bipcom.fr - 06 08 60 14 17
barbaraaugier@bipcom.fr - 06 63 84 45 73","La musique pop-rock s'invite sur l'Esplanade du Lac du Bourget. Sont notamment attendus Orelsan, Clara Luciani, Nada Surf, Fishbach, Gaëtan Roussel, Terrenoire, Aloïse Sauvage et Benjamin Biolay. ","5.871147,45.664681",,,
Auvergne-Rhône-Alpes,Rhône,Vénissieux ,Fêtes escales,14/07/2022,16/07/2022,Musique,"ville-venissieux.fr

",04 72 21 44 98,,Trois jours de concerts et spectacles gratuits au coeur du parc Louis-Dupic. A noter : l'organisation des buvettes du festival sont est confiée à des  associations pour financer des projets solidaires.  Tél 04 72 21 44 44. ILS m'ENVOIENT LES INFOS,"4.7718489,45.707486",,,
Auvergne-Rhône-Alpes,Savoie,Bourg-Saint-Maurice,Festival de musique des Arcs,15/07/2022,29/07/2022,Musique,festivaldesarcs.com,,,"Divers lieux de la station sont investis pour une quarantaine de concerts, des conférences, des ateliers et des débats. La thématique de l'année, « Les musiques romantiques françaises » offre un répertoire qui va de musiciens célèbres comme Gabriel Fauré, Georges Bizet, César Franck à des personnalités plus confidentiels comme Reynaldo Hahn ou Henri Duparc. Une soirée est consacrée aux femmes romantiques françaises, Mel Bonis, Cécile Chaminade, Louise Farrenc et Clémence de Grandval ","6.6708751,45.547671",,,
Auvergne-Rhône-Alpes,Isère,Grenoble,Cabaret frappé autrement,15/07/2022,20/07/2022,Musique,cabaret-frappe.com,04 76 00 76 85,,"La manifestation change de lieu cette année et arrive à l'anneau de vitesse au sein du parc Paul Mistral. Chaque soir, des artistes locaux entament les festivités, suivis de têtes d'affiche nationales ou internationales. Le concert d'ouverture présente le duo de musique électro-acoustique Aora Paradox, puis Camélia Jordana et Neneh Cherry enflammeront la scène. A noter, une soirée 100% québécoise avec Hubert Lenoir et Charlotte Cardin. MAIL ENVOYEYE MAISVOYE","5.6780039,45.154005",,,
Auvergne-Rhône-Alpes,Haute-Savoie,Saint-Julien-en-Genevois,Guitare en scène,13/07/2022,17/07/2022,Musique,guitare-en-scene.com,,,"La particularité de l'événement tient dans sa volonté de créer des rencontres des artistes émergents et les professionnels et entre les artistes eux-mêmes. Dans cette idée des sessions de jams sont organisées. Parmi les musiciens on trouve cette année Jeff Beck, Scorpions, Deep Purple, Nik West, The Prize, One Rusty band et Laura Cox. ","6.0468073,46.1228909",,,
Auvergne-Rhône-Alpes,Aveyron,Plateau du Larzac,Festival & Rencontres de Musique de Chambre du Larzac,28/07/2019,11/08/2019,Musique,festivaldularzac.com,05 65 62 23 64,05 65 62 79 98 (Saint eulalie),"Un quinzaine de musiciens se retrouvent, en résidence sur le plateau du Larzac. L'occasion d'entendre Brahms, Schumann, Berlioz, Prokofiev, Tchaikovsky, Schnittke, Rachmaninov ou encore Gershwin au cœur du Parc Naturel Régional des Grands Causses. Un concert ""Une colombe pour la paix"" sera donné avec le Quintette pour clarinette et cordes K 581 de Mozart et In Damascus pour ténor et quatuor à cordes de Jonathan Dove. A noter : une balade musicale en train le long de l’ancienne voie ferrée surplombant la vallée du Cernon est proposée par le trio Lemniscate autour de Schubert, Ravel, Ruiz-Pipó etc. TEL MAIS PAS DE REPONSE. A RAPPELER","2.9847847,43.7835554",,,
Auvergne-Rhône-Alpes,Puy-de-Dôme,Pontaumur,Bach en Combrailles,08/08/2022,13/08/2022,Musique,bachencombrailles.com,04 73 79 91 00,"Accent Tonique, Véronique Furlan – Tél. : 01 74 80 48 26 & 06 09 56 41 90 – accent-tonique-vf@orange.fr","Du trépas à la vie, des ténèbres à la lumière, c'est le voyage musical proposé. Parmi les 21 escales, le concert d'ouverture dévoile les sept cantates Membra Jesu Nostri de Dietrich Buxtehude par l'ensemble lyonnais Correspondances.","2.6276901,45.8396561",,,
Auvergne-Rhône-Alpes,Isère,Mens,Mens alors!,01/08/2022,06/08/2022,Musique,mensalors.fr,,Marc Chonier,"Cinq jours de musique, de danse et de contes au coeur du territoire du Trièvres, au sud de l'Isère. Sont attendus : Leïla Martial ""Oliphantre"", André Minvielle & Papanosh ""Prevert Parade"", La Litanie des Cimes, Christophe Girard Sextet, Suzanne (Jazz Migration), Mamie Jotax, la Campagnie des Musiques à Ouïr, Napoleon Maddox & Sorg, Pelouse, Boris Boublil-Mù feat. John Parish, Faune, Cannibale, Cyril Cyril.","5.691832,44.783831",,,
Auvergne-Rhône-Alpes,Isère,La-Côte-Saint-André,Festival Berlioz,18/08/2022,31/08/2022,Musique,festivalberlioz.com,04 74 20 20 79,Valérie Samuel (Opus 64) / Sophie Nicoly / Pablo S. Ruiz : 01 40 26 77 94 s.nicoly@opus64.com,"Dans la cour du Château Louis XI, à l’église de La Côte-Saint-André, au musée Hector-Berlioz ou encore dans la halle médiévale et au parc Allivet la programmation convie. Les deux grands concerts d'ouverture sont un récital avec l'Oresteïa de Iannis Xenakis inspirée de la trilogie de L’Orestie de Virgile en première partie de soirée et un concert ""Saint-Saëns le voyageur"" avec l’orchestre Divertimento de Zahia Ziouani accompagné de la flûtiste Silvia Careddu, du clarinettiste Patrick Messina, l’ensemble Amedyez et Rachid Brahim-Djelloul au chant et violon traditionnel.","5.229596,45.3464959",,,
Auvergne-Rhône-Alpes,Haute-Loire,Le Puy-en-Velay et Alentour,Festival de la Chaise-Dieu,18/08/2022,28/08/2022,Musique,chaise-dieu.com,04 71 00 01 16,,"La plupart des concerts ont lieu à l'abbatiale Saint-Robert de la Chaise Dieu et dans les églises et collégiales de Haute-Loire, du Puy-de-Dôme et de la Loire. L'ensemble Les Accents propose leur version d’Il Sedecia, oratorio romain de 1705, dernier volet du cycle consacré aux oratorios d’Alessandro Scarlatti. L'orchestre symphonique allemand les Berliner Symphoniker fait son retour avec le Concerto pour la main gauche de Ravel, le Rhapsody in Blue de Gershwin et les Danses symphoniques de Rachmaninov. ","3.8848688197085,45.0390571197085",,,
Auvergne-Rhône-Alpes,Rhône,Miribel-Jonage (Vaulx-en-Velin),Woodstower,24/08/2022,28/08/2022,Musique,woodstower.com,09 51 57 58 96,,"Les bords du lac du Grand Parc Miribel Jonage accueillent les festivaliers pour cinq jours de concerts électro et rap. Un événement qui revendique son positionnement écologique avec des scénographies imaginées à partir de matériaux recyclés, un choix de prestataires locaux et un travail sur la réduction des déchets.","4.9397558197085,45.7971055197085",,,
Auvergne-Rhône-Alpes,Haute-Savoie,Thonon-les-Bains,Montjoux festival,07/07/2022,09/07/2022,Musique,montjouxfestival.com,,,"Une grande scène et une scène nouveaux talents se partagent les artistes programmés pour trois soirées de concerts. Ayo, Janie Doe, Youssou N'Dour, Na+Na, Ben Mazué, Adama Koëta et Arnito font partie des invités. 

","6.439421,46.344076",,,
Auvergne-Rhône-Alpes,Drôme,Saoû,Saoû chante Mozart,08/07/2022,24/07/2022,Musique,saouchantemozart.com,04 75 41 00 18,,"Piano, piano-forte et clavecins sont à l'honneur grâce au fil rouge de cette année, les claviers. L’intégrale des 18 sonates pour piano sont programmées. Une ""journée dans les arbres"" est prévue avec des concerts dans la forêt et l'ouverture au lever du soleil dans les jardins du château d’Eurre.","5.038708,44.621816",,,
Auvergne-Rhône-Alpes,Allier,Vichy ,Portrait(s),24/06/2022,04/09/2022,Photo / Art contemporain,ville-vichy.fr/expositions/festival-portrait,04 70 32 15 33,,"Pour célébrer leur dix ans, les expositions se tiennent au palais des Congrès en plus des lieux extérieurs. L'oeuvre de Meryl Meisler nous plonge dans le New York des années 1970 et 1980. Elle expose deux mondes différents, celui de la nuit avec des clichés des soirées disco et des clubs de strip-tease et celui de sa vie d'enseignante en dévoilant les photos d'un collège dans le quartier de Bushwick, à Brooklyn. Une rétrospective du photographe Omar Victor Diop expose ses travaux mettant en lumière de grandes figures africaines oubliées et différents mouvements de résistance Noirs dans le monde depuis deux siècles.","3.4052679,46.1106529",,,
Auvergne-Rhône-Alpes,Loire,Saint-Etienne ,Festival des 7 Collines ,23/06/2022,02/07/2022,Théâtre / Arts de la rue / Cirque,festivaldes7collines.com,,http://www.festivaldes7collines.com/fr/presse/presentation/,"Le festival se concentre sur la danse et le cirque même si quelques concerts sont aussi prévus. Dans Katharsis, la danse contemporaine et la danse aérienne se rencontrent dans une création poétique de la Compagnie Rythmic. Dj Dino accompagne FIQ !, la performance colorée des artistes du groupe acrobatique de Tanger","4.2440541,45.371484",,,
Auvergne-Rhône-Alpes,Isère,Grenoble,Rencontres du jeune théâtre européen ,01/07/2022,10/07/2022,Théâtre / Arts de la rue / Cirque,"crearc.fr
",04 76 01 01 41,,"Pas moins de 15 compagnies venues de 13 pays se produisent en salle et dans les rues. Toutes les formes de théâtre seront représentées : classique ou contemporain, création collective, musical etc. La parade spectacle de clôture a lieu dans les rues ainsi qu'au théâtre de Verdure du Musée. Elle se déroule sur le thème du Ragnarök, un mythe scandinave qui traite de la fin d’un monde et de sa renaissance.","5.6780039,45.154005",,,
Auvergne-Rhône-Alpes,Drôme,Grignan ,Les fêtes nocturnes ,24/06/2022,20/08/2022,Théâtre / Arts de la rue / Cirque,chateaux-ladrome.fr,04 75 91 83 65 ,https://www.chateaux-ladrome.fr/fr/saison-2017-2018/evenements/noces-de-sang,"Les Fâcheux, comédie ballet en trois actes de Molière est la pièce choisie pour être jouée cette année devant la façade du château de Grignan. La comédienne et docteure en littérature et arts du spectacle Julia de Gasquet met en scène la pièce créée à l'origine au château de Vaux-le-Vicomte.  ","4.854393,44.395624",,,
Auvergne-Rhône-Alpes,Isère,Les Adrets en Belledonne,Festival de l'Arpenteur ,02/07/2022,09/07/2022,Théâtre / Arts de la rue / Cirque,https://www.scenes-obliques.eu/festival/,04 76 71 16 48,04 76 71 16 48,"""Composer les mondes"" reste le fil rouge de ce festival. Parmi les temps forts, une conférence musicale entre l'astrophysicien Aurélien Barrau et le musicien Ayoub Faouzi ; une exposition présente les oeuvres du projet ""Migration"" de Maryam Gholam Ali, artiste plasticienne afghane, exilée en France ; une journée ""Pentes afghanes"" propose autour de cette exposition, une rencontre avec l'artiste et Sakineh Gholam Ali, styliste et costumière puis un concert de la musicienne Nasima Omid et enfin la projection du film Syngué sabour - Pierre de patience ; la pièce Et les animaux réapparurent de la compagnieTeatro delle Ariette ; et un concert de l'artiste vocale et improvisatrice Leila Martial avec son trio Baa Box composé également du batteur Eric Perez et du guitariste Pierre Tereygeol.
","5.9415229,45.2345489",,,
Auvergne-Rhône-Alpes,Ardèche,Alba-la-Romaine ,Le festival d'Alba,12/07/2022,17/07/2022,Théâtre / Arts de la rue / Cirque,lefestivaldalba.org,,,"Pas moins de sept lieux d'Alba la romaine sont investis par l'art circassien. Au théâtre antique, le groupe Acrobatique de Tanger présente FIQ! (Réveille-toi !) / O.U.T.S.I.D.E, mis en scène par Maroussia Diaz Verbèke. Une suite d’acrobaties de figures et autres glissades de 15 artistes habillés par le photographe Hassan Hajjaj, le tout accompagné aux platines par Dj DINO. Au théâtre de la Roche, la compagnie Singulière se pose des questions : ""À quoi joue le monde ? A-t-on encore l’espoir d’échapper à une société de vigilance ?"" et y répond à travers son spectacle Amal/game/S ou le cirque sécuritaire.
","4.552831,44.522499",,,
Auvergne-Rhône-Alpes,Cantal,Aurillac,Festival d'Aurillac,17/08/2022,20/08/2022,Théâtre / Arts de la rue / Cirque,aurillac.net,04 71 43 43 70 ,,"L'événement met à l'honneur les artistes de rue au sens large : performance, musique, théâtre etc. Dix-neuf compagnies sont attendus avec en prime ""Le rendez-vous des Compagnies de passage"" qui ouvre le festival aux artistes qui veuleut y prendre part en auto-production. Le collectif Balle Perdue présente I'm not Giselle Carter. Entre musique, texte, danse, le spectacle commence par l'annonce de la mort de Beyonce, et pose la question de la notoriété moderne, notamment due aux réseaux sociaux. Les Dakh Daughters viennent avec leur spectacle Ukraine fire, à l'origine un cabaret punk féministe, mis à jour pour refléter la réalité de la guerre. 
","2.390477,44.890088",,,
Bourgogne Franche-Comté,Doubs,Arc-et-Senans,Festival des jardins,04/06/2022,31/10/2022,Autres,salineroyale.com,03 81 54 45 45,,"La Saline royale célèbre les 50 ans de Woodstock, événement phare du mouvement hippie, avec Flower power, Woodstock côté jardin. Le premier jardin laisse découvrir des visuels géométriques et colorés, tel un kaléidoscope. ""Flow it, Show it"" propose quant à lui d’explorer le cheveu : plantes grimpantes et rampantes composent cette création tantôt structurée, tantôt désordonnée. ""See me, feel me"" ou encore ""Transe Danse Cadence"" pourront également être explorés. MAIL ENVOYE  - DP envoyé mais j'ai rien compris, j'ai demandé qu'on s'appelle. ","5.736632,47.011408",,,
Bourgogne Franche-Comté,Nièvre,Authiou,Chemin des Arts,29/07/2022,31/07/2022,Danse,festivalcheminsdesarts.com,03 86 60 15 56,06 81 47 12 68,"La bergerie de Soffin dans la commune rurale d'Authiou accueille divers spectacles de danse. Des créations et des déambulations pour porter la danse au plus près du public. Avec Transhumance artistique, Sylvère Lamotte, danseur et chorégraphe a imaginé une performance pour emmener les spectateurs dans une itinérance avec les artistes. Une balade faite pour revisiter les notions de paysage et de frontière.","3.3893311,47.2506701",,,
Bourgogne Franche-Comté,Saône-et-Loire,Givry,Les Musicaves,29/06/2022,03/07/2022,Musique,https://festival-les-musicaves.fr/,03 85 48 37 97 (châlons) ; 03 85 44 43 36 (Givry),,"Au Domaine Thenard et au Domaine Besson les concerts et la dégustation de vin se mêlent. Un voyage sensoriel avec pas moins de 11 événements musicaux prévus. La chanteuse Nesrine, dont la voix en arabe, français et anglais est accompagnée de mélodies arabo-andalouses, classique, jazz, pop et soul fait partie des artistes invités. ","4.692074,46.74255",,,
Bourgogne Franche-Comté,Doubs,Audincourt,Rencontres et Racines,24/06/2022,26/06/2022,Musique,rencontresetracines.audincourt.fr,03 81 36 37 79,,"La diversité est le mot d'ordre de ce festival qui présente des musiques des cinq continents. Plus de 30 groupes se produisent et la scène régionale est également mise en avant. Sont notamment accueillis, Youssoupha, les Négresses Vertes, Hocus pocus, Calypso Rose,Tiken Jah Fakoly, Hoshi. A noter : pas de stands commerciaux pour nourrir les festivaliers, mais 75 associations qui composent un ""village"" et proposent leur savoir-faire culinaire. MAIL ENVOYE 
","6.8143699,47.462605",,,
Bourgogne Franche-Comté,Saône-et-Loire,Couches,Jazz à Couches,06/07/2022,09/07/2022,Musique,jazzacouches.fr,03 85 49 66 29,,"Les musiciens du Blue Quartet entament les festivités, suivis de l'orchestre du Big Band de Couches avec le vibraphoniste Franck Tortiller qui compose et arrange spécialement pour le groupe. A noter, un concert-dégustation dans le Château de Couches et un festival off qui se tient dans le centre du village.","4.519818,46.8489629",,,
Bourgogne Franche-Comté,Territoire de Belfort,Belfort,Les Eurockéennes,30/06/2022,03/07/2022,Musique,eurockeennes.fr,,,"De la presqu'île du Malsaucy, les festivaliers pourront profiter des deux plans d'eau et écouter Muse, Stromae, Nike Cave, Clara Luciani, H.E.R, Meute, Big Thief, Girl in red, Last Train, Emilie Zoé...","6.787417,47.6203341",,,
Bourgogne Franche-Comté,Côte d'Or,Beaune,Festival international d'opéra baroque et romantique ,08/07/2022,31/07/2022,Musique,festivalbeaune.com,03 80 22 97 20,,"Pour la 40e édition, la direction artistique a demandé aux chefs qui ont fait leurs débuts à Beaune la reprise de l’un de leurs grands succès ou une nouvelle production lyrique. Parmi la programmation foisonnante, de neuf opéras et 2 récitals, trois oeuvres d'Haendel : Partenope, opéra comique, Giulio Cesare et l'oratorio Solomon.","4.786901,46.9955299",,,
Bourgogne Franche-Comté,Doubs,Métabief,Festival de la Paille,29/07/2022,30/07/2022,Musique,festivalpaille.fr,03 84 25 24 77,,"Nichée au coeur des montagnes du Jura, la scène se place aux pieds des pistes de la station Métabief. Dans ce panorama exceptionnel, les festivaliers pourront écouter Kimberose, Morcheeba, Grand Corps Malade, Fallen Lillies etc.","6.3309861,46.745994",,,
Bourgogne Franche-Comté,Jura,Fraisans,No Logo,12/08/2022,14/08/2022,Musique,nologofestival.fr,03 81 81 70 51,,"C'est dans l'ancien site métallurgique des Forges de Fraisans que les trois scènes se déploient. Principalement reggae, la folk, le R&B, le hip-hop, la soul et la dub sont aussi au menu. Sara Lugo et Supa Mana, Daman, EMÉA, Steel Alive figurent parmi les artistes invités 
","5.7293909,47.0966861",,,
Bourgogne Franche-Comté,Saône-et-Loire,Bourgogne du Sud,Jazz Campus en Clunisois,20/08/2022,27/08/2022,Musique,jazzcampus.fr,07 68 23 76 74,,"A Cluny, au théâtre, au parc abbatial ou encore dans l'abbaye, les artistes confirmés ou émergents se retrouvent. Parmi les temps forts, le quartet  Racines porté par trois générations de musiciens fait la part belle aux musiques traditionnelles de Turquie, d'Arménie, de Moldavie accompagnées de quelques compositions originales. ","3.622593,46.15607",,,
